<topic-strategies xmlns:xsi="http://www.w3.org/2001/XMLSchema-instance" xsi:noNamespaceSchemaLocation="./topic-mapping.xsd">
  <strategy name="StrategyRemoveLinesFromPage - emptyLines Waldritter" index="1">
        <strategyClass>StrategyRemoveLinesFromPage</strategyClass>
        <params>
            <parameter>
                <key>applyToPage</key>
                <value>8</value>
            </parameter>
            <parameter>
                <key>fromLine</key>
                <value>4</value>
            </parameter>
            <parameter>
                <key>untilLine</key>
                <value>5</value>
            </parameter>
        </params>
    </strategy>
    <strategy name="StrategyRemoveLinesFromPage - emptyLines Seenritter" index="1">
        <strategyClass>StrategyRemoveLinesFromPage</strategyClass>
        <params>
            <parameter>
                <key>applyToPage</key>
                <value>9</value>
            </parameter>
            <parameter>
                <key>fromLine</key>
                <value>2</value>
            </parameter>
            <parameter>
                <key>untilLine</key>
                <value>3</value>
            </parameter>
        </params>
    </strategy>
    <strategy name="StrategyRemoveLinesFromPage - emptyLines Mehrer der Macht" index="1">
        <strategyClass>StrategyRemoveLinesFromPage</strategyClass>
        <params>
            <parameter>
                <key>applyToPage</key>
                <value>10</value>
            </parameter>
            <parameter>
                <key>fromLine</key>
                <value>4</value>
            </parameter>
            <parameter>
                <key>untilLine</key>
                <value>5</value>
            </parameter>
        </params>
    </strategy>
    <strategy name="StrategyRemoveLinesFromPage - emptyLines Sumudiener" index="1">
        <strategyClass>StrategyRemoveLinesFromPage</strategyClass>
        <params>
            <parameter>
                <key>applyToPage</key>
                <value>11</value>
            </parameter>
            <parameter>
                <key>fromLine</key>
                <value>2</value>
            </parameter>
            <parameter>
                <key>untilLine</key>
                <value>3</value>
            </parameter>
        </params>
    </strategy>
 </topic-strategies>
