<?xml version="1.1" encoding="UTF-8"?>
<topic-strategies xmlns:xsi="http://www.w3.org/2001/XMLSchema-instance" xsi:noNamespaceSchemaLocation="./topic-mapping.xsd">
    <strategy name="Remove Zwergwal from Page 165" index="1">
        <strategyClass>StrategyRemoveLinesFromPage</strategyClass>
        <params>
            <parameter>
                <key>applyToPage</key>
                <value>165</value>
            </parameter>
            <parameter>
                <key>fromLine</key>
                <value>9</value>
            </parameter>
            <parameter>
                <key>untilLine</key>
                <value>58</value>
            </parameter>
        </params>
    </strategy>
    <strategy name="Move variant 3 to end of Page 165" index="1">
        <strategyClass>StrategyPutToEndOfPage</strategyClass>
        <params>
            <parameter>
                <key>applyToPage</key>
                <value>165</value>
            </parameter>
            <parameter>
                <key>startEntryLineNo</key>
                <value>2</value>
            </parameter>
            <parameter>
                <key>endEntryLineNo</key>
                <value>8</value>
            </parameter>
        </params>
    </strategy>
</topic-strategies>