<?xml version="1.1" encoding="UTF-8"?>
<topic-strategies xmlns:xsi="http://www.w3.org/2001/XMLSchema-instance"
                  xsi:noNamespaceSchemaLocation="file:///C:/develop/project/dsa-pdf-reader/src/main/resources/topic-mapping.xsd">

    <strategy name="StrategyRemoveTextSize - PageNumbers" index="1">
        <strategyClass>StrategyRemoveTextSize</strategyClass>
        <params>
            <parameter>
                <key>applyToPage</key>
                <value>all</value>
            </parameter>
            <parameter>
                <key>textSize</key>
                <value>1500</value>
            </parameter>
        </params>
    </strategy>

</topic-strategies>