<topic-strategies xmlns:xsi="http://www.w3.org/2001/XMLSchema-instance" xsi:noNamespaceSchemaLocation="./topic-mapping.xsd">
    <strategy name="StrategyRemoveLinesFromPage - Prosa Rüstungen" index="1">
        <strategyClass>StrategyRemoveLinesFromPage</strategyClass>
        <params>
            <parameter>
                <key>applyToPage</key>
                <value>17</value>
            </parameter>
            <parameter>
                <key>fromLine</key>
                <value>1</value>
            </parameter>

            <parameter>
                <key>untilLine</key>
                <value>20</value>
            </parameter>
        </params>
    </strategy>
    <strategy name="StrategyRemoveLinesFromPage - Prosa Rüstungen" index="1">
        <strategyClass>StrategyRemoveLinesFromPage</strategyClass>
        <params>
            <parameter>
                <key>applyToPage</key>
                <value>18</value>
            </parameter>
            <parameter>
                <key>fromLine</key>
                <value>1</value>
            </parameter>

            <parameter>
                <key>untilLine</key>
                <value>17</value>
            </parameter>
        </params>
    </strategy>


    <strategy name="StrategyRemovePages - 221 to 252">
        <strategyClass>StrategyRemovePages</strategyClass>
        <params>
            <parameter>
                <key>applyToPage</key>
                <value>22</value>
            </parameter>
            <parameter>
                <key>untilPage</key>
                <value>22</value>
            </parameter>
        </params>
    </strategy>
    Monadenschwert Balgringa


    <strategy name="StrategyReplaceStringInLine Feenfreuend - make AP normal">
        <strategyClass>StrategyReplaceStringInLine</strategyClass>
        <params>
            <parameter>
                <key>applyToPage</key>
                <value>23</value>
            </parameter>
            <parameter>
                <key>onLine</key>
                <value>31</value>
            </parameter>
            <parameter>
                <key>oldText</key>
                <value>NameKampftechnikTPL+SAT/PA-ModRWGewichtLängePreisKomplexitätBalgringa</value>
            </parameter>
            <parameter>
                <key>newText</key>
                <value>Monadenschwert BalgringaKomplexitätNameKampftechnikTPL+SAT/PA-ModRWGewichtLängePreisKomplexitätBalgringa</value>
            </parameter>

        </params>
    </strategy>

</topic-strategies>
