<topic-strategies xmlns:xsi="http://www.w3.org/2001/XMLSchema-instance" xsi:noNamespaceSchemaLocation="./topic-mapping.xsd">
    <strategy name="StrategyRemoveLinesFromPage - Kampftechniken" index="1">
        <strategyClass>StrategyRemoveLinesFromPage</strategyClass>
        <params>
            <parameter>
                <key>applyToPage</key>
                <value>10</value>
            </parameter>
            <parameter>
                <key>fromLine</key>
                <value>1</value>
            </parameter>

            <parameter>
                <key>untilLine</key>
                <value>20</value>
            </parameter>
        </params>
    </strategy>
</topic-strategies>
