<topic-strategies xmlns:xsi="http://www.w3.org/2001/XMLSchema-instance" xsi:noNamespaceSchemaLocation="./topic-mapping.xsd">
    <strategy name="StrategyPutToEndOfPage" index="3">
        <strategyClass>
            StrategyPutToEndOfPage
        </strategyClass>
        <params>
            <parameter>
                <key>applyToPage</key>
                <value>15</value>
            </parameter>
            <parameter>
                <key>startEntryLineNo</key>
                <value>1</value>
            </parameter>
            <parameter>
                <key>endEntryLineNo</key>
                <value>41</value>
            </parameter>
        </params>
    </strategy>
    <strategy name="StrategyPutToEndOfPage" index="3">
        <strategyClass>
            StrategyPutToEndOfPage
        </strategyClass>
        <params>
            <parameter>
                <key>applyToPage</key>
                <value>16</value>
            </parameter>
            <parameter>
                <key>startEntryLineNo</key>
                <value>1</value>
            </parameter>
            <parameter>
                <key>endEntryLineNo</key>
                <value>9</value>
            </parameter>
        </params>
    </strategy>

    <strategy name="StrategyPutToEndOfPage" index="3">
        <strategyClass>
            StrategyPutToEndOfPage
        </strategyClass>
        <params>
            <parameter>
                <key>applyToPage</key>
                <value>17</value>
            </parameter>
            <parameter>
                <key>startEntryLineNo</key>
                <value>1</value>
            </parameter>
            <parameter>
                <key>endEntryLineNo</key>
                <value>50</value>
            </parameter>
        </params>
    </strategy>

    <strategy name="StrategyPutToEndOfPage" index="3">
        <strategyClass>
            StrategyPutToEndOfPage
        </strategyClass>
        <params>
            <parameter>
                <key>applyToPage</key>
                <value>18</value>
            </parameter>
            <parameter>
                <key>startEntryLineNo</key>
                <value>1</value>
            </parameter>
            <parameter>
                <key>endEntryLineNo</key>
                <value>63</value>
            </parameter>
        </params>
    </strategy>

    <strategy name="StrategyPutToEndOfPage" index="3">
        <strategyClass>
            StrategyPutToEndOfPage
        </strategyClass>
        <params>
            <parameter>
                <key>applyToPage</key>
                <value>22</value>
            </parameter>
            <parameter>
                <key>startEntryLineNo</key>
                <value>1</value>
            </parameter>
            <parameter>
                <key>endEntryLineNo</key>
                <value>68</value>
            </parameter>
        </params>
    </strategy>

    <strategy name="StrategyPutToEndOfPage" index="3">
        <strategyClass>
            StrategyPutToEndOfPage
        </strategyClass>
        <params>
            <parameter>
                <key>applyToPage</key>
                <value>15</value>
            </parameter>
            <parameter>
                <key>startEntryLineNo</key>
                <value>1</value>
            </parameter>
            <parameter>
                <key>endEntryLineNo</key>
                <value>41</value>
            </parameter>
        </params>
    </strategy>

    <strategy name="StrategyPutToEndOfPage" index="3">
        <strategyClass>
            StrategyPutToEndOfPage
        </strategyClass>
        <params>
            <parameter>
                <key>applyToPage</key>
                <value>25</value>
            </parameter>
            <parameter>
                <key>startEntryLineNo</key>
                <value>1</value>
            </parameter>
            <parameter>
                <key>endEntryLineNo</key>
                <value>20</value>
            </parameter>
        </params>
    </strategy>

    <strategy name="StrategyPutToEndOfPage" index="3">
        <strategyClass>
            StrategyPutToEndOfPage
        </strategyClass>
        <params>
            <parameter>
                <key>applyToPage</key>
                <value>26</value>
            </parameter>
            <parameter>
                <key>startEntryLineNo</key>
                <value>1</value>
            </parameter>
            <parameter>
                <key>endEntryLineNo</key>
                <value>32</value>
            </parameter>
        </params>
    </strategy>

    <strategy name="StrategyPutToEndOfPage" index="3">
        <strategyClass>
            StrategyPutToEndOfPage
        </strategyClass>
        <params>
            <parameter>
                <key>applyToPage</key>
                <value>27</value>
            </parameter>
            <parameter>
                <key>startEntryLineNo</key>
                <value>1</value>
            </parameter>
            <parameter>
                <key>endEntryLineNo</key>
                <value>52</value>
            </parameter>
        </params>
    </strategy>

    <strategy name="StrategyPutToEndOfPage" index="3">
        <strategyClass>
            StrategyPutToEndOfPage
        </strategyClass>
        <params>
            <parameter>
                <key>applyToPage</key>
                <value>29</value>
            </parameter>
            <parameter>
                <key>startEntryLineNo</key>
                <value>1</value>
            </parameter>
            <parameter>
                <key>endEntryLineNo</key>
                <value>71</value>
            </parameter>
        </params>
    </strategy>





    <strategy name="StrategyConcatLinesToFirst" index="1">
        <strategyClass>StrategyConcatLinesToFirst</strategyClass>
        <params>
            <parameter>
                <key>applyToPage</key>
                <value>18</value>
            </parameter>
            <parameter>
                <key>fromLine</key>
                <value>8</value>
            </parameter>
            <parameter>
                <key>untilLine</key>
                <value>10</value>
            </parameter>
        </params>
    </strategy>

    <strategy name="StrategyConcatLinesToFirst" index="1">
        <strategyClass>StrategyConcatLinesToFirst</strategyClass>
        <params>
            <parameter>
                <key>applyToPage</key>
                <value>18</value>
            </parameter>
            <parameter>
                <key>fromLine</key>
                <value>21</value>
            </parameter>
            <parameter>
                <key>untilLine</key>
                <value>23</value>
            </parameter>
        </params>
    </strategy>

</topic-strategies>
