<topic-strategies xmlns:xsi="http://www.w3.org/2001/XMLSchema-instance" xsi:noNamespaceSchemaLocation="./topic-mapping.xsd">
    <strategy name="Remove Box from Page 328" index="6">
        <strategyClass>StrategyRemoveLinesFromPage</strategyClass>
        <params>
            <parameter>
                <key>applyToPage</key>
                <value>328</value>
            </parameter>
            <parameter>
                <key>fromLine</key>
                <value>136</value>
            </parameter>
        </params>
    </strategy>
    <strategy name="Split QS6 of Magiesicht from effect on page 331" index="9">
        <strategyClass>StrategySplitLineAfterPosition</strategyClass>
        <params>
            <parameter>
                <key>applyToPage</key>
                <value>331</value>
            </parameter>
            <parameter>
                <key>splitLine</key>
                <value>41</value>
            </parameter>
            <parameter>
                <key>splitAfterPosition</key>
                <value>112</value>
            </parameter>
        </params>
    </strategy>
    <strategy name="End QS6 of Magiesicht with bold line on page 331" index="10">
        <strategyClass>StrategyInsertEmptyBold</strategyClass>
        <params>
            <parameter>
                <key>applyToPage</key>
                <value>331</value>
            </parameter>
            <parameter>
                <key>insertAfterLineNo</key>
                <value>41</value>
            </parameter>
            <parameter>
                <key>insertSmall</key>
                <value>true</value>
            </parameter>
        </params>
    </strategy>
    <strategy name="Remove Stabschlange from Page 332" index="11">
        <strategyClass>StrategyRemoveLinesFromPage</strategyClass>
        <params>
            <parameter>
                <key>applyToPage</key>
                <value>332</value>
            </parameter>
            <parameter>
                <key>fromLine</key>
                <value>128</value>
            </parameter>
        </params>
    </strategy>
    <strategy name="Remove LÃ¶we from Page 335" index="12">
        <strategyClass>StrategyRemoveLinesFromPage</strategyClass>
        <params>
            <parameter>
                <key>applyToPage</key>
                <value>335</value>
            </parameter>
            <parameter>
                <key>fromLine</key>
                <value>56</value>
            </parameter>
            <parameter>
                <key>untilLine</key>
                <value>108</value>
            </parameter>
        </params>
    </strategy>
</topic-strategies>
