<?xml version="1.1" encoding="UTF-8"?>
<topic-strategies xmlns:xsi="http://www.w3.org/2001/XMLSchema-instance"
                  xsi:noNamespaceSchemaLocation="file:///C:/develop/project/dsa-pdf-reader/src/main/resources/topic-mapping.xsd">
    <strategy name="Add SkillLevel to third Variant of Silentium on Page 162" index="1">
        <strategyClass>StrategyAddTextToLine</strategyClass>
        <params>
            <parameter>
                <key>applyToPage</key>
                <value>162</value>
            </parameter>
            <parameter>
                <key>lineNo</key>
                <value>18</value>
            </parameter>
            <parameter>
                <key>insertAfterPosition</key>
                <value>3</value>
            </parameter>
            <parameter>
                <key>insertText</key>
                <value>16</value>
            </parameter>
        </params>
    </strategy>
    <strategy name="Remove start of Rituals on Page 163" index="1">
        <strategyClass>StrategyRemoveSingleLineFromPage</strategyClass>
        <params>
            <parameter>
                <key>applyToPage</key>
                <value>163</value>
            </parameter>
            <parameter>
                <key>lineNo</key>
                <value>26</value>
            </parameter>
        </params>
    </strategy>
    <strategy name="Split Radau from Respondami on Page 161" index="1">
        <strategyClass>StrategySplitLineAfterPosition</strategyClass>
        <params>
            <parameter>
                <key>applyToPage</key>
                <value>161</value>
            </parameter>
            <parameter>
                <key>splitLine</key>
                <value>28</value>
            </parameter>
            <parameter>
                <key>splitAfterPosition</key>
                <value>5</value>
            </parameter>
        </params>
    </strategy>
    <strategy name="Move Title Radau to end of Page 161" index="1">
        <strategyClass>StrategyPutToEndOfPage</strategyClass>
        <params>
            <parameter>
                <key>applyToPage</key>
                <value>161</value>
            </parameter>
            <parameter>
                <key>startEntryLineNo</key>
                <value>28</value>
            </parameter>
            <parameter>
                <key>endEntryLineNo</key>
                <value>28</value>
            </parameter>
        </params>
    </strategy>
    <strategy name="Move Zaubererweiterungen-String to end of Page 161" index="1">
        <strategyClass>StrategyPutToEndOfPage</strategyClass>
        <params>
            <parameter>
                <key>applyToPage</key>
                <value>161</value>
            </parameter>
            <parameter>
                <key>startEntryLineNo</key>
                <value>57</value>
            </parameter>
            <parameter>
                <key>endEntryLineNo</key>
                <value>57</value>
            </parameter>
        </params>
    </strategy>
    <strategy name="Move Variants Radau to end of Page 161" index="1">
        <strategyClass>StrategyPutToEndOfPage</strategyClass>
        <params>
            <parameter>
                <key>applyToPage</key>
                <value>161</value>
            </parameter>
            <parameter>
                <key>startEntryLineNo</key>
                <value>58</value>
            </parameter>
            <parameter>
                <key>endEntryLineNo</key>
                <value>65</value>
            </parameter>
        </params>
    </strategy>
</topic-strategies>