<topic-strategies xmlns:xsi="http://www.w3.org/2001/XMLSchema-instance" xsi:noNamespaceSchemaLocation="./topic-mapping.xsd">
    <strategy name="StrategyRemoveTextSize - Topic headlines" index="1">
        <strategyClass>StrategyRemoveTextSize</strategyClass>
        <params>
            <parameter>
                <key>applyToPage</key>
                <value>all</value>
            </parameter>
            <parameter>
                <key>textSize</key>
                <value>1300</value>
            </parameter>
        </params>
    </strategy>
    <strategy name="StrategyReplaceStringInLine - Vorschlaghammer Kampftalent ">
        <strategyClass>StrategyReplaceStringInLine</strategyClass>
        <params>
            <parameter>
                <key>applyToPage</key>
                <value>78</value>
            </parameter>
            <parameter>
                <key>onLine</key>
                <value>28</value>
            </parameter>
            <parameter>
                <key>oldText</key>
                <value>(2H, i)2W6</value>
            </parameter>
            <parameter>
                <key>newText</key>
                <value>(2H, i)Zweihandhiebwaffen2W6</value>
            </parameter>
        </params>
    </strategy>
    <strategy name="StrategyConcatLinesToFirst - Concat TÃ¤towierungen" index="1">
        <strategyClass>StrategyConcatLinesToFirst</strategyClass>
        <params>
            <parameter>
                <key>applyToPage</key>
                <value>88</value>
            </parameter>
            <parameter>
                <key>fromLine</key>
                <value>6</value>
            </parameter>
            <parameter>
                <key>untilLine</key>
                <value>8</value>
            </parameter>
        </params>
    </strategy>
</topic-strategies>
